{
  "protocol_version": 1,
  "request_id": "aaaaaaaa-aaaa-4aaa-8aaa-aaaaaaaaaaa1",
  "server_time": "2026-08-13T17:00:00.000Z",
  "claim": {
    "claim_id": "33333333-3333-4333-8333-333333333333",
    "dog_id": "22222222-2222-4222-8222-222222222222",
    "code": "0123ABCD4567EFGH",
    "expires_at": "2026-08-13T17:15:00.000Z",
    "expires_in_seconds": 900
  }
}
